"No.","Time","Source","Destination","Protocol","Length","Info"
"1","0.000000","192.168.68.54","192.168.71.255","UDP","86","57621  >  57621 Len=44"
"2","0.955066","192.168.68.54","162.159.133.234","TLSv1.2","108","Application Data"
"3","0.955306","192.168.68.54","157.240.223.60","TLSv1.2","124","Application Data"
"4","0.955669","192.168.68.54","54.173.95.250","TLSv1.2","1410","Application Data"
"5","0.961329","192.168.68.54","142.250.186.100","TCP","54","55893  >  443 [FIN, ACK] Seq=1 Ack=1 Win=1025 Len=0"
"6","0.962356","192.168.68.54","80.69.96.12","DNS","82","Standard query 0xeae0 A felix.hs-furtwangen.de"
"7","0.963380","192.168.68.54","80.69.96.12","DNS","82","Standard query 0xa7cd HTTPS felix.hs-furtwangen.de"
"8","0.964993","192.168.68.54","45.60.76.225","TLSv1.2","3091","Application Data"
"9","0.965351","192.168.68.54","45.60.76.225","TLSv1.2","93","Application Data"
"10","0.965621","192.168.68.54","45.60.76.225","TLSv1.2","1127","Application Data"
"11","0.967311","192.168.68.54","80.69.96.12","DNS","75","Standard query 0x46cf A bam.nr-data.net"
"12","0.967813","192.168.68.54","80.69.96.12","DNS","75","Standard query 0xd99e HTTPS bam.nr-data.net"
"13","0.986417","162.159.133.234","192.168.68.54","TCP","54","443  >  53363 [ACK] Seq=1 Ack=55 Win=8 Len=0"
"14","1.001131","45.60.76.225","192.168.68.54","TCP","54","443  >  55886 [ACK] Seq=1 Ack=1421 Win=501 Len=0"
"15","1.001131","142.250.186.100","192.168.68.54","TCP","54","443  >  55893 [ACK] Seq=1 Ack=2 Win=279 Len=0"
"16","1.005047","80.69.96.12","192.168.68.54","DNS","98","Standard query response 0xeae0 A felix.hs-furtwangen.de A 217.28.108.237"
"17","1.005047","45.60.76.225","192.168.68.54","TCP","54","443  >  55886 [ACK] Seq=1 Ack=3038 Win=495 Len=0"
"18","1.005047","45.60.76.225","192.168.68.54","TCP","54","443  >  55886 [ACK] Seq=1 Ack=3077 Win=495 Len=0"
"19","1.005047","45.60.76.225","192.168.68.54","TCP","54","443  >  55886 [ACK] Seq=1 Ack=4150 Win=487 Len=0"
"20","1.005047","45.60.76.225","192.168.68.54","TLSv1.2","93","Application Data"
"21","1.009206","80.69.96.12","192.168.68.54","DNS","156","Standard query response 0x46cf A bam.nr-data.net CNAME bam.cell.nr-data.net CNAME fastly-tls12-bam.nr-data.net A 162.247.243.29"
"22","1.009206","45.60.76.225","192.168.68.54","TLSv1.2","437","Application Data"
"23","1.009206","80.69.96.12","192.168.68.54","DNS","131","Standard query response 0xa7cd HTTPS felix.hs-furtwangen.de SOA ns.hs-furtwangen.de"
"24","1.009206","80.69.96.12","192.168.68.54","DNS","229","Standard query response 0xd99e HTTPS bam.nr-data.net CNAME bam.cell.nr-data.net CNAME bam.nr-data.net.cdn.cloudflare.net SOA ns1.cloudflare.net"
"25","1.009447","192.168.68.54","45.60.76.225","TCP","54","55886  >  443 [ACK] Seq=4150 Ack=423 Win=1024 Len=0"
"26","1.010935","157.240.223.60","192.168.68.54","TLSv1.2","126","Application Data"
"27","1.011302","192.168.68.54","217.28.108.237","TCP","66","55910  >  443 [SYN] Seq=0 Win=64240 Len=0 MSS=1460 WS=256 SACK_PERM"
"28","1.012193","192.168.68.54","162.247.243.29","TCP","66","55911  >  443 [SYN] Seq=0 Win=64240 Len=0 MSS=1460 WS=256 SACK_PERM"
"29","1.043381","217.28.108.237","192.168.68.54","TCP","66","443  >  55910 [SYN, ACK] Seq=0 Ack=1 Win=64240 Len=0 MSS=1380 SACK_PERM WS=128"
"30","1.043381","162.247.243.29","192.168.68.54","TCP","66","443  >  55911 [SYN, ACK] Seq=0 Ack=1 Win=65535 Len=0 MSS=960 SACK_PERM WS=512"
"31","1.043685","192.168.68.54","217.28.108.237","TCP","54","55910  >  443 [ACK] Seq=1 Ack=1 Win=262144 Len=0"
"32","1.043835","192.168.68.54","162.247.243.29","TCP","54","55911  >  443 [ACK] Seq=1 Ack=1 Win=262912 Len=0"
"33","1.044517","192.168.68.54","162.247.243.29","TLSv1.3","2114","Client Hello (SNI=bam.nr-data.net)"
"34","1.045165","192.168.68.54","217.28.108.237","TLSv1.3","1881","Client Hello (SNI=felix.hs-furtwangen.de)"
"35","1.062382","192.168.68.54","157.240.223.60","TCP","54","54176  >  443 [ACK] Seq=71 Ack=73 Win=1024 Len=0"
"36","1.074124","162.247.243.29","192.168.68.54","TCP","54","443  >  55911 [ACK] Seq=1 Ack=961 Win=98304 Len=0"
"37","1.082125","162.247.243.29","192.168.68.54","TCP","54","443  >  55911 [ACK] Seq=1 Ack=2061 Win=100352 Len=0"
"38","1.082125","162.247.243.29","192.168.68.54","TLSv1.3","1010","Server Hello, Change Cipher Spec, Application Data"
"39","1.082125","162.247.243.29","192.168.68.54","TCP","1010","443  >  55911 [PSH, ACK] Seq=957 Ack=2061 Win=100352 Len=956 [TCP segment of a reassembled PDU]"
"40","1.082125","162.247.243.29","192.168.68.54","TCP","1010","443  >  55911 [ACK] Seq=1913 Ack=2061 Win=100352 Len=956 [TCP segment of a reassembled PDU]"
"41","1.082125","162.247.243.29","192.168.68.54","TLSv1.3","1010","Application Data"
"42","1.082125","162.247.243.29","192.168.68.54","TLSv1.3","487","Application Data, Application Data, Application Data"
"43","1.082125","54.173.95.250","192.168.68.54","TLSv1.2","152","Application Data"
"44","1.082886","192.168.68.54","162.247.243.29","TCP","54","55911  >  443 [ACK] Seq=2061 Ack=4258 Win=262912 Len=0"
"45","1.083634","192.168.68.54","162.247.243.29","TLSv1.3","118","Change Cipher Spec, Application Data"
"46","1.083814","217.28.108.237","192.168.68.54","TCP","54","443  >  55910 [ACK] Seq=1 Ack=1381 Win=64128 Len=0"
"47","1.083814","217.28.108.237","192.168.68.54","TCP","54","443  >  55910 [ACK] Seq=1 Ack=1828 Win=63744 Len=0"
"48","1.083814","162.159.133.234","192.168.68.54","TLSv1.2","88","Application Data"
"49","1.084361","192.168.68.54","162.247.243.29","TLSv1.3","1327","Application Data"
"50","1.088471","217.28.108.237","192.168.68.54","TLSv1.3","1434","Server Hello, Change Cipher Spec, Application Data"
"51","1.088471","217.28.108.237","192.168.68.54","TLSv1.3","1096","Application Data, Application Data, Application Data"
"52","1.088855","192.168.68.54","217.28.108.237","TCP","54","55910  >  443 [ACK] Seq=1828 Ack=2423 Win=262144 Len=0"
"53","1.090019","192.168.68.54","217.28.108.237","TLSv1.3","134","Change Cipher Spec, Application Data"
"54","1.090384","192.168.68.54","217.28.108.237","TLSv1.3","1065","Application Data"
"55","1.111438","162.247.243.29","192.168.68.54","TCP","54","443  >  55911 [ACK] Seq=4258 Ack=2125 Win=100352 Len=0"
"56","1.111438","162.247.243.29","192.168.68.54","TCP","54","443  >  55911 [ACK] Seq=4258 Ack=3398 Win=102912 Len=0"
"57","1.122800","192.168.68.54","54.173.95.250","TCP","54","55813  >  443 [ACK] Seq=1357 Ack=99 Win=511 Len=0"
"58","1.123470","217.28.108.237","192.168.68.54","TLSv1.3","133","Application Data"
"59","1.123470","217.28.108.237","192.168.68.54","TLSv1.3","133","Application Data"
"60","1.123470","217.28.108.237","192.168.68.54","TCP","1434","443  >  55910 [ACK] Seq=2581 Ack=2919 Win=64128 Len=1380 [TCP segment of a reassembled PDU]"
"61","1.123470","217.28.108.237","192.168.68.54","TLSv1.3","319","Application Data"
"62","1.123808","192.168.68.54","217.28.108.237","TCP","54","55910  >  443 [ACK] Seq=2919 Ack=4226 Win=262144 Len=0"
"63","1.137715","192.168.68.54","162.159.133.234","TCP","54","53363  >  443 [ACK] Seq=55 Ack=35 Win=1024 Len=0"
"64","1.185955","192.168.68.54","23.50.131.152","TCP","55","55885  >  443 [ACK] Seq=1 Ack=1 Win=1024 Len=1 [TCP segment of a reassembled PDU]"
"65","1.209412","23.50.131.152","192.168.68.54","TCP","66","443  >  55885 [ACK] Seq=1 Ack=2 Win=501 Len=0 SLE=1 SRE=2"
"66","1.223695","162.247.243.29","192.168.68.54","TLSv1.3","440","Application Data, Application Data"
"67","1.276947","192.168.68.54","162.247.243.29","TCP","54","55911  >  443 [ACK] Seq=3398 Ack=4644 Win=262400 Len=0"
"68","3.108494","192.168.68.1","239.255.255.250","SSDP","493","NOTIFY * HTTP/1.1 "
"69","3.108494","fe80::ae15:a2ff:fe44:9448","ff02::c","SSDP","500","NOTIFY * HTTP/1.1 "
"70","3.416615","162.159.133.234","192.168.68.54","TLSv1.2","148","Application Data"
"71","3.457900","192.168.68.54","162.159.133.234","TCP","54","53363  >  443 [ACK] Seq=55 Ack=129 Win=1024 Len=0"
"72","3.722795","TPLink_44:94:48","Broadcast","ARP","60","Who has 192.168.68.52? Tell 192.168.68.1"
"73","3.952679","192.168.68.54","18.210.82.135","TLSv1.2","125","Application Data"
"74","4.134710","18.210.82.135","192.168.68.54","TLSv1.2","148","Application Data"
"75","4.165847","162.159.133.234","192.168.68.54","TLSv1.2","173","Application Data"
"76","4.183376","192.168.68.54","18.210.82.135","TCP","54","55811  >  443 [ACK] Seq=72 Ack=95 Win=514 Len=0"
"77","4.213872","192.168.68.54","162.159.133.234","TCP","54","53363  >  443 [ACK] Seq=55 Ack=248 Win=1023 Len=0"
"78","4.954067","192.168.68.54","54.173.95.250","TLSv1.2","125","Application Data"
"79","5.013140","142.250.184.202","192.168.68.54","TLSv1.2","138","Application Data"
"80","5.029854","192.168.68.54","142.250.184.202","TLSv1.2","89","Application Data"
"81","5.030124","192.168.68.54","142.250.184.202","TLSv1.2","89","Application Data"
"82","5.064171","142.250.184.202","192.168.68.54","TCP","54","443  >  55888 [ACK] Seq=85 Ack=36 Win=400 Len=0"
"83","5.070713","142.250.184.202","192.168.68.54","TCP","54","443  >  55888 [ACK] Seq=85 Ack=71 Win=400 Len=0"
"84","5.070713","54.173.95.250","192.168.68.54","TLSv1.2","148","Application Data"
"85","5.124197","192.168.68.54","54.173.95.250","TCP","54","55813  >  443 [ACK] Seq=1428 Ack=193 Win=511 Len=0"
"86","6.593818","192.168.68.54","35.186.224.34","TLSv1.2","97","Application Data"
"87","6.631727","35.186.224.34","192.168.68.54","TCP","54","443  >  52294 [ACK] Seq=1 Ack=44 Win=290 Len=0"
"88","6.634609","35.186.224.34","192.168.68.54","TLSv1.2","94","Application Data"
"89","6.680768","192.168.68.54","35.186.224.34","TCP","54","52294  >  443 [ACK] Seq=44 Ack=41 Win=1024 Len=0"
"90","7.000366","162.159.133.234","192.168.68.54","TLSv1.2","143","Application Data"
"91","7.052032","192.168.68.54","162.159.133.234","TCP","54","53363  >  443 [ACK] Seq=55 Ack=337 Win=1023 Len=0"
"92","7.101167","192.168.68.1","239.255.255.250","SSDP","495","NOTIFY * HTTP/1.1 "
"93","7.111882","fe80::ae15:a2ff:fe44:9448","ff02::c","SSDP","502","NOTIFY * HTTP/1.1 "
"94","7.348066","192.168.68.54","192.229.221.95","TCP","54","55222  >  80 [RST, ACK] Seq=1 Ack=1 Win=0 Len=0"
"95","7.348066","192.168.68.54","92.123.104.53","TCP","54","55213  >  443 [RST, ACK] Seq=1 Ack=1 Win=0 Len=0"
"96","7.363789","192.168.68.54","92.123.104.7","TCP","54","55210  >  443 [RST, ACK] Seq=1 Ack=1 Win=0 Len=0"
"97","7.820061","162.159.133.234","192.168.68.54","TLSv1.2","192","Application Data"
"98","7.867550","192.168.68.54","162.159.133.234","TCP","54","53363  >  443 [ACK] Seq=55 Ack=475 Win=1022 Len=0"
"99","8.160048","192.168.68.54","216.239.32.180","TLSv1.2","2423","Application Data"
"100","8.160186","192.168.68.54","216.239.32.180","TLSv1.2","93","Application Data"
"101","8.160255","192.168.68.54","216.239.32.180","TLSv1.2","161","Application Data"
"102","8.202450","216.239.32.180","192.168.68.54","TCP","54","443  >  55880 [ACK] Seq=1 Ack=1413 Win=488 Len=0"
"103","8.202450","216.239.32.180","192.168.68.54","TCP","54","443  >  55880 [ACK] Seq=1 Ack=2370 Win=489 Len=0"
"104","8.202450","216.239.32.180","192.168.68.54","TCP","54","443  >  55880 [ACK] Seq=1 Ack=2409 Win=489 Len=0"
"105","8.202450","216.239.32.180","192.168.68.54","TCP","54","443  >  55880 [ACK] Seq=1 Ack=2516 Win=489 Len=0"
"106","8.203907","216.239.32.180","192.168.68.54","TLSv1.2","93","Application Data"
"107","8.252723","192.168.68.54","216.239.32.180","TCP","54","55880  >  443 [ACK] Seq=2516 Ack=40 Win=1020 Len=0"
"108","8.434692","216.239.32.180","192.168.68.54","TLSv1.2","613","Application Data"
"109","8.434692","216.239.32.180","192.168.68.54","TLSv1.2","129","Application Data"
"110","8.434692","216.239.32.180","192.168.68.54","TLSv1.2","85","Application Data"
"111","8.434692","216.239.32.180","192.168.68.54","TLSv1.2","93","Application Data"
"112","8.435000","192.168.68.54","216.239.32.180","TCP","54","55880  >  443 [ACK] Seq=2516 Ack=744 Win=1025 Len=0"
"113","8.436441","192.168.68.54","216.239.32.180","TLSv1.2","89","Application Data"
"114","8.436658","192.168.68.54","216.239.32.180","TLSv1.2","93","Application Data"
"115","8.450845","192.168.68.54","142.250.74.206","TCP","66","55912  >  443 [SYN] Seq=0 Win=64240 Len=0 MSS=1460 WS=256 SACK_PERM"
"116","8.467755","216.239.32.180","192.168.68.54","TCP","54","443  >  55880 [ACK] Seq=744 Ack=2590 Win=489 Len=0"
"117","8.488481","142.250.74.206","192.168.68.54","TCP","66","443  >  55912 [SYN, ACK] Seq=0 Ack=1 Win=65535 Len=0 MSS=1412 SACK_PERM WS=256"
"118","8.488801","192.168.68.54","142.250.74.206","TCP","54","55912  >  443 [ACK] Seq=1 Ack=1 Win=262400 Len=0"
"119","8.490226","192.168.68.54","142.250.74.206","TLSv1.3","2242","Client Hello (SNI=clients6.google.com)"
"120","8.523953","142.250.74.206","192.168.68.54","TCP","54","443  >  55912 [ACK] Seq=1 Ack=1413 Win=68608 Len=0"
"121","8.523953","142.250.74.206","192.168.68.54","TCP","54","[TCP Dup ACK 120#1] 443  >  55912 [ACK] Seq=1 Ack=1413 Win=68608 Len=0"
"122","8.523953","142.250.74.206","192.168.68.54","TCP","54","443  >  55912 [ACK] Seq=1 Ack=2189 Win=71424 Len=0"
"123","8.535048","142.250.74.206","192.168.68.54","TLSv1.3","1466","Server Hello, Change Cipher Spec"
"124","8.535048","142.250.74.206","192.168.68.54","TLSv1.3","110","Application Data"
"125","8.535643","192.168.68.54","142.250.74.206","TCP","54","55912  >  443 [ACK] Seq=2189 Ack=1469 Win=262400 Len=0"
"126","8.536972","192.168.68.54","142.250.74.206","TLSv1.3","128","Change Cipher Spec, Application Data"
"127","8.537539","192.168.68.54","142.250.74.206","TLSv1.3","146","Application Data"
"128","8.538189","192.168.68.54","142.250.74.206","TLSv1.3","905","Application Data"
"129","8.570399","142.250.74.206","192.168.68.54","TLSv1.3","1022","Application Data, Application Data"
"130","8.571372","192.168.68.54","142.250.74.206","TLSv1.3","85","Application Data"
"131","8.576868","142.250.74.206","192.168.68.54","TLSv1.3","85","Application Data"
"132","8.583651","142.250.74.206","192.168.68.54","TCP","54","443  >  55912 [ACK] Seq=2468 Ack=3206 Win=74240 Len=0"
"133","8.605158","142.250.74.206","192.168.68.54","TCP","54","443  >  55912 [ACK] Seq=2468 Ack=3237 Win=74240 Len=0"
"134","8.618978","192.168.68.54","142.250.74.206","TCP","54","55912  >  443 [ACK] Seq=3237 Ack=2468 Win=261632 Len=0"
"135","8.636538","TPLink_44:94:48","Broadcast","ARP","60","Who has 192.168.68.54? Tell 192.168.68.1"
"136","8.636751","Intel_8c:31:f1","TPLink_44:94:48","ARP","42","192.168.68.54 is at cc:d9:ac:8c:31:f1"
"137","8.702071","142.250.74.206","192.168.68.54","TLSv1.3","696","Application Data"
"138","8.702071","142.250.74.206","192.168.68.54","TLSv1.3","93","[TCP Previous segment not captured] , Application Data"
"139","8.702071","142.250.74.206","192.168.68.54","TCP","85","[TCP Out-Of-Order] 443  >  55912 [PSH, ACK] Seq=3110 Ack=3237 Win=74240 Len=31"
"140","8.702268","192.168.68.54","142.250.74.206","TCP","66","55912  >  443 [ACK] Seq=3237 Ack=3110 Win=262400 Len=0 SLE=3141 SRE=3180"
"141","8.702368","192.168.68.54","142.250.74.206","TCP","54","55912  >  443 [ACK] Seq=3237 Ack=3180 Win=262400 Len=0"
"142","8.703601","192.168.68.54","142.250.74.206","TLSv1.3","93","Application Data"
"143","8.704036","192.168.68.54","142.250.74.206","TLSv1.2","3198","Application Data"
"144","8.704185","192.168.68.54","142.250.74.206","TLSv1.2","93","Application Data"
"145","8.704324","192.168.68.54","142.250.74.206","TLSv1.2","16460","Application Data"
"146","8.704483","192.168.68.54","142.250.74.206","TCP","1466","55889  >  443 [ACK] Seq=19590 Ack=1 Win=1025 Len=1412 [TCP segment of a reassembled PDU]"
"147","8.739360","142.250.74.206","192.168.68.54","TCP","54","443  >  55912 [ACK] Seq=3180 Ack=3276 Win=74240 Len=0"
"148","8.751626","142.250.74.206","192.168.68.54","TCP","54","443  >  55889 [ACK] Seq=1 Ack=2825 Win=345 Len=0"
"149","8.751626","142.250.74.206","192.168.68.54","TCP","54","443  >  55889 [ACK] Seq=1 Ack=4596 Win=367 Len=0"
"150","8.751626","142.250.74.206","192.168.68.54","TCP","54","443  >  55889 [ACK] Seq=1 Ack=7420 Win=389 Len=0"
"151","8.751626","142.250.74.206","192.168.68.54","TLSv1.2","93","Application Data"
"152","8.751838","192.168.68.54","142.250.74.206","TLSv1.2","15586","Application Data"
"153","8.757373","142.250.74.206","192.168.68.54","TCP","54","443  >  55889 [ACK] Seq=40 Ack=10244 Win=411 Len=0"
"154","8.757373","142.250.74.206","192.168.68.54","TCP","54","443  >  55889 [ACK] Seq=40 Ack=13068 Win=433 Len=0"
"155","8.757495","192.168.68.54","142.250.74.206","TCP","11350","55889  >  443 [ACK] Seq=36534 Ack=40 Win=1025 Len=11296 [TCP segment of a reassembled PDU]"
"156","8.766551","142.250.74.206","192.168.68.54","TCP","54","443  >  55889 [ACK] Seq=40 Ack=14480 Win=444 Len=0"
"157","8.766551","142.250.74.206","192.168.68.54","TCP","54","443  >  55889 [ACK] Seq=40 Ack=15892 Win=455 Len=0"
"158","8.766551","142.250.74.206","192.168.68.54","TCP","54","443  >  55889 [ACK] Seq=40 Ack=17304 Win=466 Len=0"
"159","8.766551","142.250.74.206","192.168.68.54","TCP","54","443  >  55889 [ACK] Seq=40 Ack=18716 Win=477 Len=0"
"160","8.766551","142.250.74.206","192.168.68.54","TCP","54","443  >  55889 [ACK] Seq=40 Ack=19590 Win=488 Len=0"
"161","8.766551","142.250.74.206","192.168.68.54","TCP","54","443  >  55889 [ACK] Seq=40 Ack=21002 Win=489 Len=0"
"162","8.767070","192.168.68.54","142.250.74.206","TLSv1.2","15586","Application Data"
"163","8.791853","142.250.74.206","192.168.68.54","TCP","54","443  >  55889 [ACK] Seq=40 Ack=22414 Win=489 Len=0"
"164","8.791853","142.250.74.206","192.168.68.54","TCP","54","443  >  55889 [ACK] Seq=40 Ack=23826 Win=489 Len=0"
"165","8.792044","192.168.68.54","142.250.74.206","TLSv1.2","5702","Application Data"
"166","8.800312","142.250.74.206","192.168.68.54","TCP","54","443  >  55889 [ACK] Seq=40 Ack=25238 Win=489 Len=0"
"167","8.800312","142.250.74.206","192.168.68.54","TCP","54","443  >  55889 [ACK] Seq=40 Ack=26650 Win=489 Len=0"
"168","8.800312","142.250.74.206","192.168.68.54","TCP","54","443  >  55889 [ACK] Seq=40 Ack=28062 Win=489 Len=0"
"169","8.800312","142.250.74.206","192.168.68.54","TCP","54","443  >  55889 [ACK] Seq=40 Ack=29474 Win=489 Len=0"
"170","8.800312","142.250.74.206","192.168.68.54","TCP","54","443  >  55889 [ACK] Seq=40 Ack=30886 Win=489 Len=0"
"171","8.800312","142.250.74.206","192.168.68.54","TCP","54","443  >  55889 [ACK] Seq=40 Ack=32298 Win=489 Len=0"
"172","8.800792","192.168.68.54","142.250.74.206","TLSv1.2","16998","Application Data"
"173","8.805569","142.250.74.206","192.168.68.54","TCP","54","443  >  55889 [ACK] Seq=40 Ack=33710 Win=489 Len=0"
"174","8.805569","142.250.74.206","192.168.68.54","TCP","54","443  >  55889 [ACK] Seq=40 Ack=35122 Win=489 Len=0"
"175","8.805569","142.250.74.206","192.168.68.54","TCP","54","443  >  55889 [ACK] Seq=40 Ack=36534 Win=489 Len=0"
"176","8.805569","142.250.74.206","192.168.68.54","TCP","54","443  >  55889 [ACK] Seq=40 Ack=37946 Win=489 Len=0"
"177","8.805569","142.250.74.206","192.168.68.54","TCP","54","443  >  55889 [ACK] Seq=40 Ack=39358 Win=489 Len=0"
"178","8.805772","192.168.68.54","142.250.74.206","TCP","14174","55889  >  443 [PSH, ACK] Seq=85954 Ack=40 Win=1025 Len=14120 [TCP segment of a reassembled PDU]"
"179","8.811777","142.250.74.206","192.168.68.54","TCP","54","443  >  55889 [ACK] Seq=40 Ack=40770 Win=489 Len=0"
"180","8.811777","142.250.74.206","192.168.68.54","TCP","54","443  >  55889 [ACK] Seq=40 Ack=43594 Win=489 Len=0"
"181","8.811949","192.168.68.54","142.250.74.206","TLSv1.2","1727","Application Data, Application Data"
"182","8.815956","142.250.74.206","192.168.68.54","TCP","54","443  >  55889 [ACK] Seq=40 Ack=46418 Win=489 Len=0"
"183","8.815956","142.250.74.206","192.168.68.54","TCP","54","443  >  55889 [ACK] Seq=40 Ack=49242 Win=489 Len=0"
"184","8.815956","142.250.74.206","192.168.68.54","TCP","54","443  >  55889 [ACK] Seq=40 Ack=52066 Win=489 Len=0"
"185","8.820359","142.250.74.206","192.168.68.54","TCP","54","443  >  55889 [ACK] Seq=40 Ack=54890 Win=489 Len=0"
"186","8.821975","142.250.74.206","192.168.68.54","TCP","54","443  >  55889 [ACK] Seq=40 Ack=57714 Win=489 Len=0"
"187","8.821975","142.250.74.206","192.168.68.54","TCP","54","443  >  55889 [ACK] Seq=40 Ack=60538 Win=500 Len=0"
"188","8.821975","142.250.74.206","192.168.68.54","TCP","54","443  >  55889 [ACK] Seq=40 Ack=61950 Win=511 Len=0"
"189","8.821975","142.250.74.206","192.168.68.54","TCP","54","443  >  55889 [ACK] Seq=40 Ack=63362 Win=522 Len=0"
"190","8.825349","142.250.74.206","192.168.68.54","TCP","54","443  >  55889 [ACK] Seq=40 Ack=64774 Win=533 Len=0"
"191","8.825349","142.250.74.206","192.168.68.54","TCP","54","443  >  55889 [ACK] Seq=40 Ack=66186 Win=545 Len=0"
"192","8.831408","142.250.74.206","192.168.68.54","TCP","54","443  >  55889 [ACK] Seq=40 Ack=67598 Win=556 Len=0"
"193","8.831408","142.250.74.206","192.168.68.54","TCP","54","443  >  55889 [ACK] Seq=40 Ack=69010 Win=567 Len=0"
"194","8.831408","142.250.74.206","192.168.68.54","TCP","54","443  >  55889 [ACK] Seq=40 Ack=70422 Win=578 Len=0"
"195","8.831408","142.250.74.206","192.168.68.54","TCP","54","443  >  55889 [ACK] Seq=40 Ack=71834 Win=589 Len=0"
"196","8.831408","142.250.74.206","192.168.68.54","TCP","54","443  >  55889 [ACK] Seq=40 Ack=73246 Win=600 Len=0"
"197","8.831408","142.250.74.206","192.168.68.54","TCP","54","443  >  55889 [ACK] Seq=40 Ack=74658 Win=611 Len=0"
"198","8.836870","142.250.74.206","192.168.68.54","TCP","54","443  >  55889 [ACK] Seq=40 Ack=76070 Win=622 Len=0"
"199","8.836870","142.250.74.206","192.168.68.54","TCP","54","443  >  55889 [ACK] Seq=40 Ack=77482 Win=633 Len=0"
"200","8.836870","142.250.74.206","192.168.68.54","TCP","54","443  >  55889 [ACK] Seq=40 Ack=78894 Win=644 Len=0"
"201","8.836870","142.250.74.206","192.168.68.54","TCP","54","443  >  55889 [ACK] Seq=40 Ack=80306 Win=655 Len=0"
"202","8.836870","142.250.74.206","192.168.68.54","TCP","54","443  >  55889 [ACK] Seq=40 Ack=81718 Win=666 Len=0"
"203","8.836870","142.250.74.206","192.168.68.54","TCP","54","443  >  55889 [ACK] Seq=40 Ack=83130 Win=677 Len=0"
"204","8.836870","142.250.74.206","192.168.68.54","TCP","54","443  >  55889 [ACK] Seq=40 Ack=84542 Win=688 Len=0"
"205","8.844273","142.250.74.206","192.168.68.54","TCP","54","443  >  55889 [ACK] Seq=40 Ack=85954 Win=699 Len=0"
"206","8.844273","142.250.74.206","192.168.68.54","TCP","54","443  >  55889 [ACK] Seq=40 Ack=87366 Win=710 Len=0"
"207","8.844273","142.250.74.206","192.168.68.54","TCP","54","443  >  55889 [ACK] Seq=40 Ack=88778 Win=721 Len=0"
"208","8.844273","142.250.74.206","192.168.68.54","TCP","54","443  >  55889 [ACK] Seq=40 Ack=90190 Win=732 Len=0"
"209","8.844273","142.250.74.206","192.168.68.54","TCP","54","443  >  55889 [ACK] Seq=40 Ack=91602 Win=743 Len=0"
"210","8.849430","142.250.74.206","192.168.68.54","TCP","54","443  >  55889 [ACK] Seq=40 Ack=93014 Win=754 Len=0"
"211","8.849430","142.250.74.206","192.168.68.54","TCP","54","443  >  55889 [ACK] Seq=40 Ack=94426 Win=765 Len=0"
"212","8.849430","142.250.74.206","192.168.68.54","TCP","54","443  >  55889 [ACK] Seq=40 Ack=95838 Win=776 Len=0"
"213","8.849430","142.250.74.206","192.168.68.54","TCP","54","443  >  55889 [ACK] Seq=40 Ack=97250 Win=787 Len=0"
"214","8.852350","142.250.74.206","192.168.68.54","TCP","54","443  >  55889 [ACK] Seq=40 Ack=98662 Win=798 Len=0"
"215","8.855197","142.250.74.206","192.168.68.54","TCP","54","443  >  55889 [ACK] Seq=40 Ack=100074 Win=809 Len=0"
"216","8.860961","142.250.74.206","192.168.68.54","TCP","54","443  >  55889 [ACK] Seq=40 Ack=101486 Win=820 Len=0"
"217","8.860961","142.250.74.206","192.168.68.54","TCP","54","443  >  55889 [ACK] Seq=40 Ack=101747 Win=831 Len=0"
"218","8.862572","192.168.68.54","52.111.243.2","TLSv1.2","82","Application Data"
"219","8.959928","52.111.243.2","192.168.68.54","TCP","54","443  >  55671 [ACK] Seq=1 Ack=29 Win=16382 Len=0"
"220","9.803369","192.168.68.54","52.111.243.2","TLSv1.2","82","Application Data"
"221","9.887243","52.111.243.2","192.168.68.54","TCP","54","443  >  55672 [ACK] Seq=1 Ack=29 Win=16384 Len=0"
"222","10.379712","142.250.74.206","192.168.68.54","TLSv1.2","1362","Application Data"
"223","10.379712","142.250.74.206","192.168.68.54","TLSv1.2","1466","Application Data"
"224","10.379712","142.250.74.206","192.168.68.54","TLSv1.2","697","Application Data, Application Data"
"225","10.379712","142.250.74.206","192.168.68.54","TLSv1.2","93","Application Data"
"226","10.380187","192.168.68.54","142.250.74.206","TCP","54","55889  >  443 [ACK] Seq=101747 Ack=3442 Win=1025 Len=0"
"227","10.383890","192.168.68.54","142.250.74.206","TLSv1.2","89","Application Data"
"228","10.384146","192.168.68.54","142.250.74.206","TLSv1.2","93","Application Data"
"229","10.391675","142.250.74.206","192.168.68.54","TCP","93","[TCP Spurious Retransmission] 443  >  55889 [PSH, ACK] Seq=3403 Ack=101747 Win=831 Len=39"
"230","10.391946","192.168.68.54","142.250.74.206","TCP","66","[TCP Dup ACK 226#1] 55889  >  443 [ACK] Seq=101821 Ack=3442 Win=1025 Len=0 SLE=3403 SRE=3442"
"231","10.397585","192.168.68.54","216.239.32.180","TLSv1.2","2491","Application Data"
"232","10.397954","192.168.68.54","216.239.32.180","TLSv1.2","366","Application Data"
"233","10.400311","192.168.68.54","216.239.32.180","TLSv1.2","2515","Application Data"
"234","10.400676","192.168.68.54","216.239.32.180","TLSv1.2","402","Application Data"
"235","10.415555","142.250.74.206","192.168.68.54","TCP","54","443  >  55889 [ACK] Seq=3442 Ack=101782 Win=831 Len=0"
"236","10.415555","142.250.74.206","192.168.68.54","TCP","54","443  >  55889 [ACK] Seq=3442 Ack=101821 Win=831 Len=0"
"237","10.420016","142.250.74.206","192.168.68.54","TCP","54","[TCP Dup ACK 236#1] 443  >  55889 [ACK] Seq=3442 Ack=101821 Win=831 Len=0"
"238","10.435881","216.239.32.180","192.168.68.54","TCP","54","443  >  55880 [ACK] Seq=744 Ack=5027 Win=489 Len=0"
"239","10.435881","216.239.32.180","192.168.68.54","TCP","54","443  >  55880 [ACK] Seq=744 Ack=6751 Win=489 Len=0"
"240","10.439017","216.239.32.180","192.168.68.54","TCP","54","443  >  55880 [ACK] Seq=744 Ack=8148 Win=489 Len=0"
"241","10.688387","216.239.32.180","192.168.68.54","TLSv1.2","563","Application Data"
"242","10.688387","216.239.32.180","192.168.68.54","TLSv1.2","85","Application Data"
"243","10.688387","216.239.32.180","192.168.68.54","TLSv1.2","93","Application Data"
"244","10.688668","192.168.68.54","216.239.32.180","TCP","54","55880  >  443 [ACK] Seq=8148 Ack=1323 Win=1023 Len=0"
"245","10.689751","192.168.68.54","216.239.32.180","TLSv1.2","93","Application Data"
"246","10.730576","216.239.32.180","192.168.68.54","TCP","54","443  >  55880 [ACK] Seq=1323 Ack=8187 Win=489 Len=0"
"247","11.028494","192.168.68.54","172.64.155.141","TCP","55","55890  >  443 [ACK] Seq=1 Ack=1 Win=1024 Len=1 [TCP segment of a reassembled PDU]"
"248","11.054425","172.64.155.141","192.168.68.54","TCP","66","443  >  55890 [ACK] Seq=1 Ack=2 Win=8 Len=0 SLE=1 SRE=2"
"249","11.139851","192.168.68.54","104.18.32.115","TCP","55","55891  >  443 [ACK] Seq=1 Ack=1 Win=1025 Len=1 [TCP segment of a reassembled PDU]"
"250","11.169981","104.18.32.115","192.168.68.54","TCP","66","443  >  55891 [ACK] Seq=1 Ack=2 Win=8 Len=0 SLE=1 SRE=2"
"251","11.175896","216.239.32.180","192.168.68.54","TLSv1.2","560","Application Data"
"252","11.175896","216.239.32.180","192.168.68.54","TLSv1.2","85","Application Data"
"253","11.175896","216.239.32.180","192.168.68.54","TLSv1.2","93","Application Data"
"254","11.176046","192.168.68.54","216.239.32.180","TCP","54","55880  >  443 [ACK] Seq=8187 Ack=1899 Win=1021 Len=0"
"255","11.176837","192.168.68.54","216.239.32.180","TLSv1.2","93","Application Data"
"256","11.203246","216.239.32.180","192.168.68.54","TCP","54","443  >  55880 [ACK] Seq=1899 Ack=8226 Win=489 Len=0"
"257","11.299109","246.3936.1","0.0.0","TIPC","208","Payld:Low    McastMsg type:10122 inst:100-100"
"258","11.408334","192.168.68.54","142.250.74.206","TLSv1.2","2895","Application Data"
"259","11.438318","142.250.74.206","192.168.68.54","TCP","54","443  >  55889 [ACK] Seq=3442 Ack=103233 Win=842 Len=0"
"260","11.438318","142.250.74.206","192.168.68.54","TCP","54","443  >  55889 [ACK] Seq=3442 Ack=104645 Win=853 Len=0"
"261","11.438318","142.250.74.206","192.168.68.54","TCP","54","443  >  55889 [ACK] Seq=3442 Ack=104662 Win=853 Len=0"
"262","11.711173","142.250.74.206","192.168.68.54","TLSv1.2","1043","Application Data"
"263","11.711173","142.250.74.206","192.168.68.54","TLSv1.2","1466","Application Data"
"264","11.711173","142.250.74.206","192.168.68.54","TLSv1.2","1466","Application Data"
"265","11.711173","142.250.74.206","192.168.68.54","TLSv1.2","854","Application Data"
"266","11.711173","142.250.74.206","192.168.68.54","TLSv1.2","118","Application Data"
"267","11.711173","142.250.74.206","192.168.68.54","TLSv1.2","93","Application Data"
"268","11.711376","192.168.68.54","142.250.74.206","TCP","54","55889  >  443 [ACK] Seq=104662 Ack=8158 Win=1025 Len=0"
"269","11.712583","192.168.68.54","142.250.74.206","TLSv1.2","93","Application Data"
"270","11.717878","192.168.68.54","216.239.32.180","TLSv1.2","2509","Application Data"
"271","11.717991","192.168.68.54","216.239.32.180","TLSv1.2","316","Application Data"
"272","11.723953","192.168.68.54","142.250.74.206","TLSv1.2","2980","Application Data"
"273","11.743534","142.250.74.206","192.168.68.54","TCP","54","443  >  55889 [ACK] Seq=8158 Ack=104701 Win=853 Len=0"
"274","11.743534","142.250.74.206","192.168.68.54","TCP","54","[TCP Dup ACK 273#1] 443  >  55889 [ACK] Seq=8158 Ack=104701 Win=853 Len=0"
"275","11.751425","216.239.32.180","192.168.68.54","TCP","54","443  >  55880 [ACK] Seq=1899 Ack=9638 Win=489 Len=0"
"276","11.751425","216.239.32.180","192.168.68.54","TCP","54","443  >  55880 [ACK] Seq=1899 Ack=10681 Win=489 Len=0"
"277","11.751425","216.239.32.180","192.168.68.54","TCP","54","443  >  55880 [ACK] Seq=1899 Ack=10943 Win=489 Len=0"
"278","11.763300","142.250.74.206","192.168.68.54","TCP","54","443  >  55889 [ACK] Seq=8158 Ack=106113 Win=864 Len=0"
"279","11.763300","142.250.74.206","192.168.68.54","TCP","54","443  >  55889 [ACK] Seq=8158 Ack=107525 Win=875 Len=0"
"280","11.763300","142.250.74.206","192.168.68.54","TCP","54","443  >  55889 [ACK] Seq=8158 Ack=107627 Win=875 Len=0"
"281","11.915459","162.159.133.234","192.168.68.54","TLSv1.2","155","Application Data"
"282","11.934307","216.239.32.180","192.168.68.54","TLSv1.2","564","Application Data"
"283","11.934307","216.239.32.180","192.168.68.54","TLSv1.2","85","Application Data"
"284","11.934307","216.239.32.180","192.168.68.54","TLSv1.2","93","Application Data"
"285","11.934529","192.168.68.54","216.239.32.180","TCP","54","55880  >  443 [ACK] Seq=10943 Ack=2479 Win=1025 Len=0"
"286","11.935477","192.168.68.54","216.239.32.180","TLSv1.2","93","Application Data"
"287","11.952833","192.168.68.54","104.18.32.115","TLSv1.2","122","Application Data"
"288","11.960762","216.239.32.180","192.168.68.54","TCP","54","443  >  55880 [ACK] Seq=2479 Ack=10982 Win=489 Len=0"
"289","11.966140","192.168.68.54","216.58.206.78","TLSv1.2","2579","Application Data"
"290","11.966263","192.168.68.54","216.58.206.78","TLSv1.2","93","Application Data"
"291","11.966328","192.168.68.54","216.58.206.78","TLSv1.2","3075","Application Data"
"292","11.967338","192.168.68.54","162.159.133.234","TCP","54","53363  >  443 [ACK] Seq=55 Ack=576 Win=1028 Len=0"
"293","11.997393","104.18.32.115","192.168.68.54","TCP","54","443  >  55288 [ACK] Seq=1 Ack=69 Win=8 Len=0"
"294","12.019457","216.58.206.78","192.168.68.54","TCP","54","443  >  55892 [ACK] Seq=1 Ack=1413 Win=323 Len=0"
"295","12.019457","216.58.206.78","192.168.68.54","TCP","54","443  >  55892 [ACK] Seq=1 Ack=2526 Win=334 Len=0"
"296","12.019457","216.58.206.78","192.168.68.54","TCP","54","443  >  55892 [ACK] Seq=1 Ack=2565 Win=334 Len=0"
"297","12.019457","216.58.206.78","192.168.68.54","TCP","54","443  >  55892 [ACK] Seq=1 Ack=3977 Win=345 Len=0"
"298","12.019457","216.58.206.78","192.168.68.54","TCP","54","443  >  55892 [ACK] Seq=1 Ack=5389 Win=356 Len=0"
"299","12.019457","216.58.206.78","192.168.68.54","TCP","54","443  >  55892 [ACK] Seq=1 Ack=5586 Win=367 Len=0"
"300","12.019457","216.58.206.78","192.168.68.54","TLSv1.2","93","Application Data"
"301","12.030586","216.58.206.78","192.168.68.54","TLSv1.2","612","Application Data"
"302","12.030586","216.58.206.78","192.168.68.54","TLSv1.2","434","Application Data"
"303","12.030586","216.58.206.78","192.168.68.54","TLSv1.2","205","Application Data"
"304","12.030586","216.58.206.78","192.168.68.54","TLSv1.2","93","Application Data"
"305","12.030817","192.168.68.54","216.58.206.78","TCP","54","55892  >  443 [ACK] Seq=5586 Ack=1168 Win=1025 Len=0"
"306","12.032172","192.168.68.54","216.58.206.78","TLSv1.2","89","Application Data"
"307","12.032376","192.168.68.54","216.58.206.78","TLSv1.2","93","Application Data"
"308","12.064383","216.58.206.78","192.168.68.54","TCP","54","443  >  55892 [ACK] Seq=1168 Ack=5660 Win=367 Len=0"
"309","12.079403","142.250.74.206","192.168.68.54","TLSv1.2","1049","Application Data"
"310","12.079403","142.250.74.206","192.168.68.54","TLSv1.2","332","Application Data"
"311","12.079403","142.250.74.206","192.168.68.54","TLSv1.2","253","Application Data"
"312","12.079403","142.250.74.206","192.168.68.54","TLSv1.2","93","Application Data"
"313","12.079676","192.168.68.54","142.250.74.206","TCP","54","55889  >  443 [ACK] Seq=107627 Ack=9669 Win=1025 Len=0"
"314","12.080982","192.168.68.54","142.250.74.206","TLSv1.2","93","Application Data"
"315","12.085050","192.168.68.54","216.239.32.180","TLSv1.2","2514","Application Data"
"316","12.085183","192.168.68.54","216.239.32.180","TLSv1.2","316","Application Data"
"317","12.111852","142.250.74.206","192.168.68.54","TCP","54","443  >  55889 [ACK] Seq=9669 Ack=107666 Win=875 Len=0"
"318","12.120195","216.239.32.180","192.168.68.54","TCP","54","443  >  55880 [ACK] Seq=2479 Ack=12394 Win=489 Len=0"
"319","12.120195","216.239.32.180","192.168.68.54","TCP","54","443  >  55880 [ACK] Seq=2479 Ack=13442 Win=489 Len=0"
"320","12.120195","216.239.32.180","192.168.68.54","TCP","54","443  >  55880 [ACK] Seq=2479 Ack=13704 Win=489 Len=0"
"321","12.530567","216.239.32.180","192.168.68.54","TLSv1.2","561","Application Data"
"322","12.530567","216.239.32.180","192.168.68.54","TLSv1.2","85","Application Data"
"323","12.530567","216.239.32.180","192.168.68.54","TLSv1.2","93","Application Data"
"324","12.530805","192.168.68.54","216.239.32.180","TCP","54","55880  >  443 [ACK] Seq=13704 Ack=3056 Win=1023 Len=0"
"325","12.532478","192.168.68.54","216.239.32.180","TLSv1.2","93","Application Data"
"326","12.562841","216.239.32.180","192.168.68.54","TCP","54","443  >  55880 [ACK] Seq=3056 Ack=13743 Win=489 Len=0"
"327","13.042497","192.168.68.1","239.255.255.250","SSDP","431","NOTIFY * HTTP/1.1 "
"328","13.042497","192.168.68.1","239.255.255.250","SSDP","440","NOTIFY * HTTP/1.1 "
"329","13.042497","fe80::ae15:a2ff:fe44:9448","ff02::c","SSDP","447","NOTIFY * HTTP/1.1 "
"330","13.867312","192.168.68.54","104.18.32.115","TLSv1.2","138","Ignored Unknown Record"
"331","13.867408","192.168.68.54","104.18.32.115","TLSv1.2","93","Application Data"
"332","13.867460","192.168.68.54","104.18.32.115","TLSv1.2","1372","Application Data"
"333","13.904275","104.18.32.115","192.168.68.54","TCP","54","443  >  55891 [ACK] Seq=1 Ack=86 Win=8 Len=0"
"334","13.910608","104.18.32.115","192.168.68.54","TCP","54","443  >  55891 [ACK] Seq=1 Ack=125 Win=8 Len=0"
"335","13.910608","104.18.32.115","192.168.68.54","TCP","54","443  >  55891 [ACK] Seq=1 Ack=1443 Win=8 Len=0"
"336","13.910608","104.18.32.115","192.168.68.54","TLSv1.2","93","Application Data"
"337","13.937787","104.18.32.115","192.168.68.54","TLSv1.2","344","Application Data"
"338","13.937787","104.18.32.115","192.168.68.54","TLSv1.2","101","Application Data"
"339","13.937787","104.18.32.115","192.168.68.54","TLSv1.2","85","Application Data"
"340","13.937961","192.168.68.54","104.18.32.115","TCP","54","55891  >  443 [ACK] Seq=1443 Ack=408 Win=1023 Len=0"
"341","13.938688","192.168.68.54","104.18.32.115","TLSv1.2","89","Application Data"
"342","14.005353","104.18.32.115","192.168.68.54","TCP","54","443  >  55891 [ACK] Seq=408 Ack=1478 Win=8 Len=0"
"343","14.576796","TPLink_44:94:48","Broadcast","ARP","42","Who has 192.168.68.51? Tell 192.168.68.1"
"344","14.927515","192.168.68.54","104.18.32.115","TLSv1.2","195","Application Data"
"345","14.927755","192.168.68.54","104.18.32.115","TLSv1.2","1290","Application Data"
"346","14.952592","104.18.32.115","192.168.68.54","TCP","54","443  >  55891 [ACK] Seq=408 Ack=1619 Win=8 Len=0"
"347","14.952592","104.18.32.115","192.168.68.54","TCP","54","443  >  55891 [ACK] Seq=408 Ack=2855 Win=8 Len=0"
"348","15.010795","104.18.32.115","192.168.68.54","TLSv1.2","346","Application Data"
"349","15.010795","104.18.32.115","192.168.68.54","TLSv1.2","101","Application Data"
"350","15.010795","104.18.32.115","192.168.68.54","TLSv1.2","85","Application Data"
"351","15.011329","192.168.68.54","104.18.32.115","TCP","54","55891  >  443 [ACK] Seq=2855 Ack=778 Win=1028 Len=0"
"352","15.599974","TPLink_44:94:48","Broadcast","ARP","42","Who has 192.168.68.51? Tell 192.168.68.1"
"353","16.421118","162.159.133.234","192.168.68.54","TLSv1.2","189","Application Data"
"354","16.421118","54.173.95.250","192.168.68.54","TCP","54","[TCP Keep-Alive] 443  >  55813 [ACK] Seq=192 Ack=1428 Win=27 Len=0"
"355","16.421292","192.168.68.54","54.173.95.250","TCP","54","[TCP Keep-Alive ACK] 55813  >  443 [ACK] Seq=1428 Ack=193 Win=511 Len=0"
"356","16.463850","192.168.68.54","162.159.133.234","TCP","54","53363  >  443 [ACK] Seq=55 Ack=711 Win=1027 Len=0"
"357","16.503711","192.168.68.54","142.250.186.100","TCP","66","55913  >  443 [SYN] Seq=0 Win=64240 Len=0 MSS=1460 WS=256 SACK_PERM"
"358","16.521271","TPLink_44:94:48","Broadcast","ARP","42","Who has 192.168.68.51? Tell 192.168.68.1"
"359","16.542949","142.250.186.100","192.168.68.54","TCP","66","443  >  55913 [SYN, ACK] Seq=0 Ack=1 Win=65535 Len=0 MSS=1412 SACK_PERM WS=256"
"360","16.543152","192.168.68.54","142.250.186.100","TCP","54","55913  >  443 [ACK] Seq=1 Ack=1 Win=262400 Len=0"
"361","16.543893","192.168.68.54","142.250.186.100","TLSv1.3","1874","Client Hello (SNI=www.google.com)"
"362","16.582036","142.250.186.100","192.168.68.54","TCP","54","443  >  55913 [ACK] Seq=1 Ack=1413 Win=68608 Len=0"
"363","16.582036","142.250.186.100","192.168.68.54","TCP","54","[TCP Dup ACK 362#1] 443  >  55913 [ACK] Seq=1 Ack=1413 Win=68608 Len=0"
"364","16.585835","142.250.186.100","192.168.68.54","TCP","54","443  >  55913 [ACK] Seq=1 Ack=1821 Win=71424 Len=0"
"365","16.594940","142.250.186.100","192.168.68.54","TLSv1.3","1466","Server Hello, Change Cipher Spec"
"366","16.594940","142.250.186.100","192.168.68.54","TCP","1466","443  >  55913 [PSH, ACK] Seq=1413 Ack=1821 Win=71424 Len=1412 [TCP segment of a reassembled PDU]"
"367","16.594940","142.250.186.100","192.168.68.54","TCP","1466","443  >  55913 [ACK] Seq=2825 Ack=1821 Win=71424 Len=1412 [TCP segment of a reassembled PDU]"
"368","16.594940","142.250.186.100","192.168.68.54","TLSv1.3","1169","Application Data"
"369","16.595254","192.168.68.54","142.250.186.100","TCP","54","55913  >  443 [ACK] Seq=1821 Ack=5352 Win=262400 Len=0"
"370","16.595950","192.168.68.54","142.250.186.100","TLSv1.3","128","Change Cipher Spec, Application Data"
"371","16.596185","192.168.68.54","142.250.186.100","TLSv1.3","146","Application Data"
"372","16.596424","192.168.68.54","142.250.186.100","TLSv1.3","2296","Application Data"
"373","16.629640","142.250.186.100","192.168.68.54","TCP","54","443  >  55913 [ACK] Seq=5352 Ack=1987 Win=71424 Len=0"
"374","16.629640","142.250.186.100","192.168.68.54","TLSv1.3","1012","Application Data, Application Data"
